{
  "schema_version": 1,
  "node_id": "53494D0000000001",
  "source": "simulator",
  "session_id": "15f75ec4-29ab-48ab-93be-81d3e0708a68",
  "sequence": 0,
  "message_id": "53494D0000000001:15f75ec4-29ab-48ab-93be-81d3e0708a68:attributes:0",
  "observed_at": "2026-10-08T14:00:00.000Z",
  "published_at": "2026-10-08T14:00:00.000Z",
  "clock_source": "simulator_host",
  "profile_id": "demo-lfp-4s-v1",
  "chemistry": "LFP",
  "capacity_ah": 100,
  "cell_count": 4,
  "cell_channels": [0, 1, 2, 3],
  "temperature_sensor_count": 2,
  "temperature_sensor_channels": [0, 1],
  "supported_fields": [
    "balancing_mask",
    "bms_state",
    "bms_state_code",
    "cell_temperature_max",
    "cell_temperatures",
    "cell_voltage_avg_reported",
    "cell_voltage_delta",
    "cell_voltage_max_reported",
    "cell_voltage_min_reported",
    "cell_voltages",
    "component_temperature_max",
    "error_flags",
    "faults",
    "ic_temperature",
    "mosfet_temperature",
    "pack_current",
    "pack_voltage_reported",
    "soc",
    "stack_voltage_reported"
  ],
  "simulation_time_factor": 1,
  "firmware_reference": "779d20199bff2666e01371ce2f562dcda4d6bda3",
  "manufacturer": "Simulator",
  "device_type": "Libre Solar BMS demo",
  "hardware_version": "not-hardware",
  "firmware_version": "reference-only"
}
